### ISSUE TITLE
TCP packet not redirected 

### ISSUE THREAD

**Issue by Monk3yDLuffy** [xdp-project/xdp-tutorial#279]
After going through tutorial in packet03, I tried redirecting packets send to one docker instance to another container using xdp. I followed instruction provided in assignment 3 in packet03 to reroute packet received and created 2 dockers vs1 and vs2. I am getting the packet at vs2 when i run `ping 172.17.0.2` but got `Destination Host Unreachable` on system(used to send packets to vs1).
### System configuration
```
lovekush@lovekush-ThinkPad-E14-Gen-2:~$ uname -r
5.13.0-35-generic

```
1. I created docker using code

### Docker configurations

```
vs1
Platform: linux
MacAddress: 02:42:ac:11:00:02
IPv4Address: 172.17.0.2
ifname: vethad59fd5

vs2
Platform: linux
MacAddress: 02:42:ac:11:00:03
IPv4Address: 172.17.0.3
ifname: vethcda19ae

````
2. Then I compile the code (just run make in the parent directory) and attach the "xdp_redirect_map" and "xdp_pass" program to the ingress of the network interface(vethad59fd5 & vethcda19ae) at host side and use the ./xdp_prog_user program to populate the redirect_params maps:

```
lovekush@lovekush-ThinkPad-E14-Gen-2:~/Desktop/xdp-tutorial/packet03-redirecting$ make
lovekush@lovekush-ThinkPad-E14-Gen-2:~/Desktop/xdp-tutorial/packet03-redirecting$ sudo ./xdp_loader --dev vethad59fd5 --force --progsec xdp_redirect_map
Success: Loaded BPF-object(xdp_prog_kern.o) and used section(xdp_redirect_map)
 - XDP prog attached on device:vethad59fd5(ifindex:10)
 - Unpinning (remove) prev maps in /sys/fs/bpf/vethad59fd5/
 - Pinning maps in /sys/fs/bpf/vethad59fd5/
lovekush@lovekush-ThinkPad-E14-Gen-2:~/Desktop/xdp-tutorial/packet03-redirecting$ sudo ./xdp_loader --dev vethcda19ae --force --progsec xdp_pass
Success: Loaded BPF-object(xdp_prog_kern.o) and used section(xdp_pass)
 - XDP prog attached on device:vethcda19ae(ifindex:12)
 - Unpinning (remove) prev maps in /sys/fs/bpf/vethcda19ae/
 - Pinning maps in /sys/fs/bpf/vethcda19ae/
lovekush@lovekush-ThinkPad-E14-Gen-2:~/Desktop/xdp-tutorial/packet03-redirecting$ sudo ./xdp_prog_user -d vethad59fd5 -r vethcda19ae --src-mac 02:42:ac:11:00:02  --dest-mac 02:42:ac:11:00:03
map dir: /sys/fs/bpf/vethad59fd5
redirect from ifnum=10 to ifnum=12
forward: 02:42:ac:11:00:02 -> 02:42:ac:11:00:03
lovekush@lovekush-ThinkPad-E14-Gen-2:~/Desktop/xdp-tutorial/packet03-redirecting$ sudo ./xdp_prog_user -r vethad59fd5 -d vethcda19ae --dest-mac 02:42:ac:11:00:02  --src-mac 02:42:ac:11:00:03
map dir: /sys/fs/bpf/vethcda19ae
redirect from ifnum=12 to ifnum=10
forward: 02:42:ac:11:00:03 -> 02:42:ac:11:00:02
```
### Result xdp_stats
```
lovekush@lovekush-ThinkPad-E14-Gen-2:~/Desktop/xdp-tutorial/packet03-redirecting$ sudo ./xdp_stats --dev vethad59fd5

Collecting stats from BPF map
 - BPF map (bpf_map_type:6) id:10 name:xdp_stats_map key_size:4 value_size:16 max_entries:5
XDP-action  
XDP_ABORTED            0 pkts (         0 pps)           0 Kbytes (     0 Mbits/s) period:0.250215
XDP_DROP               0 pkts (         0 pps)           0 Kbytes (     0 Mbits/s) period:0.250260
XDP_PASS               0 pkts (         0 pps)           0 Kbytes (     0 Mbits/s) period:0.250269
XDP_TX                 0 pkts (         0 pps)           0 Kbytes (     0 Mbits/s) period:0.250277
XDP_REDIRECT           6 pkts (         0 pps)           0 Kbytes (     0 Mbits/s) period:0.250285

^C
```
### Result of ping
```
lovekush@lovekush-ThinkPad-E14-Gen-2:~/Desktop/xdp-tutorial/packet03-redirecting$ ping 172.17.0.2
PING 172.17.0.2 (172.17.0.2) 56(84) bytes of data.
From 172.17.0.1 icmp_seq=1 Destination Host Unreachable
From 172.17.0.1 icmp_seq=2 Destination Host Unreachable
From 172.17.0.1 icmp_seq=3 Destination Host Unreachable
^C
--- 172.17.0.2 ping statistics ---
6 packets transmitted, 0 received, +3 errors, 100% packet loss, time 5101ms
pipe 3
lovekush@lovekush-ThinkPad-E14-Gen-2:~/Desktop/xdp-tutorial/packet03-redirecting$ ping 172.17.0.3
PING 172.17.0.3 (172.17.0.3) 56(84) bytes of data.
64 bytes from 172.17.0.3: icmp_seq=1 ttl=64 time=0.138 ms
64 bytes from 172.17.0.3: icmp_seq=2 ttl=64 time=0.076 ms
64 bytes from 172.17.0.3: icmp_seq=3 ttl=64 time=0.067 ms
64 bytes from 172.17.0.3: icmp_seq=4 ttl=64 time=0.083 ms
^C
--- 172.17.0.3 ping statistics ---
4 packets transmitted, 4 received, 0% packet loss, time 3065ms
rtt min/avg/max/mdev = 0.067/0.091/0.138/0.027 ms
lovekush@lovekush-ThinkPad-E14-Gen-2:~/Desktop/xdp-tutorial/packet03-redirecting$ 

```
### Result of tcpdump on 172.17.0.2 (vs2)
```
root@be8c4ecaad1d:/# tcpdump -i eth0
tcpdump: verbose output suppressed, use -v or -vv for full protocol decode
listening on eth0, link-type EN10MB (Ethernet), capture size 262144 bytes
11:29:52.550067 ARP, Request who-has 172.17.0.2 tell 172.17.0.1, length 28
11:29:52.550620 IP be8c4ecaad1d.57695 > 103.62.236.83.domain: 52745+ PTR? 2.0.17.172.in-addr.arpa. (41)
11:29:52.564925 IP 103.62.236.83.domain > be8c4ecaad1d.57695: 52745 NXDomain* 0/1/0 (95)
11:29:52.565171 IP be8c4ecaad1d.49294 > 103.62.236.83.domain: 61796+ PTR? 1.0.17.172.in-addr.arpa. (41)
11:29:52.577452 IP 103.62.236.83.domain > be8c4ecaad1d.49294: 61796 NXDomain* 0/1/0 (95)
11:29:52.577794 IP be8c4ecaad1d.45570 > 103.62.236.83.domain: 15535+ PTR? 83.236.62.103.in-addr.arpa. (44)
11:29:52.580861 IP 103.62.236.83.domain > be8c4ecaad1d.45570: 15535 NXDomain 0/1/0 (101)
11:29:53.577967 ARP, Request who-has 172.17.0.2 tell 172.17.0.1, length 28
11:29:54.601945 ARP, Request who-has 172.17.0.2 tell 172.17.0.1, length 28
11:29:55.625989 ARP, Request who-has 172.17.0.2 tell 172.17.0.1, length 28
11:29:56.649941 ARP, Request who-has 172.17.0.2 tell 172.17.0.1, length 28
11:29:57.673910 ARP, Request who-has 172.17.0.2 tell 172.17.0.1, length 28
11:29:57.769904 ARP, Request who-has 172.17.0.1 tell be8c4ecaad1d, length 28
11:29:57.769901 ARP, Request who-has be8c4ecaad1d tell 172.17.0.1, length 28
11:29:57.769939 ARP, Reply be8c4ecaad1d is-at 02:42:ac:11:00:03 (oui Unknown), length 28
11:29:57.770124 ARP, Reply 172.17.0.1 is-at 02:42:9d:eb:fa:65 (oui Unknown), length 28
11:29:58.698010 ARP, Request who-has 172.17.0.2 tell 172.17.0.1, length 28
11:29:59.721802 ARP, Request who-has 172.17.0.2 tell 172.17.0.1, length 28
11:30:00.745913 ARP, Request who-has 172.17.0.2 tell 172.17.0.1, length 28
11:30:01.770117 ARP, Request who-has 172.17.0.2 tell 172.17.0.1, length 28
11:30:02.793937 ARP, Request who-has 172.17.0.2 tell 172.17.0.1, length 28
11:30:03.817915 ARP, Request who-has 172.17.0.2 tell 172.17.0.1, length 28


```
Is there something i am doing i am doing wrong or need something more to redirect tcp packets?

**Comment by tohojo** [comment]
Monk3yDLuffy ***@***.***> writes:

> ### Result of ping
> ```
> ***@***.***:~/Desktop/xdp-tutorial/packet03-redirecting$ ping 172.17.0.2
> PING 172.17.0.2 (172.17.0.2) 56(84) bytes of data.
> From 172.17.0.1 icmp_seq=1 Destination Host Unreachable
> From 172.17.0.1 icmp_seq=2 Destination Host Unreachable
> From 172.17.0.1 icmp_seq=3 Destination Host Unreachable
> ^C
> --- 172.17.0.2 ping statistics ---
> 6 packets transmitted, 0 received, +3 errors, 100% packet loss, time 5101ms
> pipe 3
> ***@***.***:~/Desktop/xdp-tutorial/packet03-redirecting$ ping 172.17.0.3
> PING 172.17.0.3 (172.17.0.3) 56(84) bytes of data.
> 64 bytes from 172.17.0.3: icmp_seq=1 ttl=64 time=0.138 ms
> 64 bytes from 172.17.0.3: icmp_seq=2 ttl=64 time=0.076 ms
> 64 bytes from 172.17.0.3: icmp_seq=3 ttl=64 time=0.067 ms
> 64 bytes from 172.17.0.3: icmp_seq=4 ttl=64 time=0.083 ms
> ^C
> --- 172.17.0.3 ping statistics ---
> 4 packets transmitted, 4 received, 0% packet loss, time 3065ms
> rtt min/avg/max/mdev = 0.067/0.091/0.138/0.027 ms
> ***@***.***:~/Desktop/xdp-tutorial/packet03-redirecting$ 
>
> ```
> ### Result of tcpdump on 172.17.0.2 (vs2)
> ```
> ***@***.***:/# tcpdump -i eth0
> tcpdump: verbose output suppressed, use -v or -vv for full protocol decode
> listening on eth0, link-type EN10MB (Ethernet), capture size 262144 bytes
> 11:29:52.550067 ARP, Request who-has 172.17.0.2 tell 172.17.0.1, length 28
> 11:29:52.550620 IP be8c4ecaad1d.57695 > 103.62.236.83.domain: 52745+ PTR? 2.0.17.172.in-addr.arpa. (41)
> 11:29:52.564925 IP 103.62.236.83.domain > be8c4ecaad1d.57695: 52745 NXDomain* 0/1/0 (95)
> 11:29:52.565171 IP be8c4ecaad1d.49294 > 103.62.236.83.domain: 61796+ PTR? 1.0.17.172.in-addr.arpa. (41)
> 11:29:52.577452 IP 103.62.236.83.domain > be8c4ecaad1d.49294: 61796 NXDomain* 0/1/0 (95)
> 11:29:52.577794 IP be8c4ecaad1d.45570 > 103.62.236.83.domain: 15535+ PTR? 83.236.62.103.in-addr.arpa. (44)
> 11:29:52.580861 IP 103.62.236.83.domain > be8c4ecaad1d.45570: 15535 NXDomain 0/1/0 (101)
> 11:29:53.577967 ARP, Request who-has 172.17.0.2 tell 172.17.0.1, length 28
> 11:29:54.601945 ARP, Request who-has 172.17.0.2 tell 172.17.0.1, length 28
> 11:29:55.625989 ARP, Request who-has 172.17.0.2 tell 172.17.0.1, length 28
> 11:29:56.649941 ARP, Request who-has 172.17.0.2 tell 172.17.0.1, length 28
> 11:29:57.673910 ARP, Request who-has 172.17.0.2 tell 172.17.0.1, length 28
> 11:29:57.769904 ARP, Request who-has 172.17.0.1 tell be8c4ecaad1d, length 28
> 11:29:57.769901 ARP, Request who-has be8c4ecaad1d tell 172.17.0.1, length 28
> 11:29:57.769939 ARP, Reply be8c4ecaad1d is-at 02:42:ac:11:00:03 (oui Unknown), length 28
> 11:29:57.770124 ARP, Reply 172.17.0.1 is-at 02:42:9d:eb:fa:65 (oui Unknown), length 28
> 11:29:58.698010 ARP, Request who-has 172.17.0.2 tell 172.17.0.1, length 28
> 11:29:59.721802 ARP, Request who-has 172.17.0.2 tell 172.17.0.1, length 28
> 11:30:00.745913 ARP, Request who-has 172.17.0.2 tell 172.17.0.1, length 28
> 11:30:01.770117 ARP, Request who-has 172.17.0.2 tell 172.17.0.1, length 28
> 11:30:02.793937 ARP, Request who-has 172.17.0.2 tell 172.17.0.1, length 28
> 11:30:03.817915 ARP, Request who-has 172.17.0.2 tell 172.17.0.1, length 28
>
>
> ```

Looks like your XDP program is redirecting all traffic on the interface,
which means ARP doesn't work (you're not getting any ARP replies), so
you're not actually sending any 'ping' packets, and the "host
unreachable" is emitted because the kernel can't figure out where to
send the packets.

> Is there something i am doing i am doing wrong or need something more
> to redirect tcp packets?

Nothing special to redirect them; some extra work may be needed to
actually get a connection depending on your topology...

**Comment by Monk3yDLuffy** [comment]
> Nothing special to redirect them; some extra work may be needed to
actually get a connection depending on your topology...

Currently i using my system to host 2 docker instances and sending packets to vs1 from my system, and i am not sure how to achieve connection for the following setup just by using xdp.

**Comment by tohojo** [comment]
Monk3yDLuffy ***@***.***> writes:

>> Nothing special to redirect them; some extra work may be needed to
>> actually get a connection depending on your topology...
>
> Currently i using my system to host 2 docker instances and sending
> packets to vs1 from my system, and i am not sure how to achieve
> connection for the following setup just by using xdp.

This is more of a "networking architecture" issue than an actual XDP
issue, so I'm afraid that is too broad a question to answer here...
